,title,description,originallink,link,pubData
737,경기 중 인종차별 욕설 들은 <b>황희찬</b> &quot;누구도 이런 일 겪어선 안돼&quot;,"프리시즌 경기 중 인종차별을 당한 <b>황희찬</b>(26‧울버햄튼)이 더 이상 피해자가 나와서는 안 된다고 주장했다. <b>황희찬</b>은 2일(한국시간) 자신의 사회관계망서비스(SNS)에 “구단, 스태프, 동료, 팬 등이 많은 응원 메시지... ",https://hankookilbo.com/News/Read/A2022080211320002988?did=NA,https://n.news.naver.com/mnews/article/469/0000689439?sid=102,"Tue, 02 Aug 2022 11:35:00 +0900"
738,&apos;인종차별&apos; 당한 <b>황희찬</b> &quot;누구도 이런 일 겪어선 안 돼&quot;,"친선경기에서 인종차별을 당한 <b>황희찬</b>(26·울버햄튼)이 인종차별 행위를 강하게 규탄했다. <b>황희찬</b>은 한국시간으로 2일 인스타그램에 &quot;구단, 스태프, 동료, 팬분들까지 많은 응원 메시지를 보내주셔서 감사하다&quot;며 &quot;우리는... ",http://www.goodkyung.com/news/articleView.html?idxno=183689,http://www.goodkyung.com/news/articleView.html?idxno=183689,"Tue, 02 Aug 2022 11:32:00 +0900"
739,&quot;이제 그만&quot;...인종차별 당한 <b>황희찬</b> 소신 발언에 벤투호 동료들도 응원,<b>황희찬</b>의 목소리에 대한민국 대표팀 동료들이 힘을 실었다. 울버햄튼은 1일 오전 2시 45분(한국시간)... 엉덩이 부상과 컨디션 난조로 프리시즌 내내 뛰지 못하던 <b>황희찬</b>은 이날 경기에서 출전을 했다. 0-1로 뒤지던 후반... ,http://www.interfootball.co.kr/news/articleView.html?idxno=577975,https://sports.news.naver.com/news.nhn?oid=413&aid=0000143894,"Tue, 02 Aug 2022 11:31:00 +0900"
740,"인종차별 당한 <b>황희찬</b> &quot;우리 모두가 같은 인간, 누구도 이런 일 겪어선 안 돼...","프리시즌 친선전에서 인종차별을 당한 &apos;황소&apos; <b>황희찬</b>(26·울버햄턴 원더러스)이 개인 SNS를 통해 인종차별 행위를 규탄했다. <b>황희찬</b>은 2일(한국시각) 개인 인스타그램을 열어 &quot;구단 스태프, 동료, 팬분들까지 많은 응원... ",http://sports.chosun.com/news/ntype.htm?id=202208020100013300000560&servicedate=20220802,https://sports.news.naver.com/news.nhn?oid=076&aid=0003899894,"Tue, 02 Aug 2022 11:30:00 +0900"
741,<b>황희찬</b> “그 누구도 이런 일을 겪어선 안 돼… 인종차별 반대”,잉글랜드 프로축구 프리미어리그(EPL)의 울버햄튼 원더러스의 <b>황희찬</b>(26)이 프리시즌 친선경기 도중 벌어진 인종차별 행위와 관련해 비판의 목소리를 냈다. <b>황희찬</b>은 2일 자신의 사회관계망서비스(SNS)에 영어와 한국어로... ,https://news.kmib.co.kr/article/view.asp?arcid=0017334477&code=61161311&cp=nv,https://sports.news.naver.com/news.nhn?oid=005&aid=0001543847,"Tue, 02 Aug 2022 11:26:00 +0900"
742,"<b>황희찬</b>, 프리시즌 첫 골 후 인종차별 당해 논란… &quot;누구도 겪어서는 안 돼&quot;","<b>황희찬</b>, 소셜 미디어 통해 &quot;이 세상 그 누구도 이런 일을 겪어서는 안 된다&quot; / 사진: ⓒ<b>황희찬</b> 인스타그램 손흥민(30, 토트넘 홋스퍼)에 이어 <b>황희찬</b>(26, 울버햄튼 윈더러스)도 인종차별을 당했다. <b>황희찬</b>은 2일(한국시간)... ",http://www.sisafocus.co.kr/news/articleView.html?idxno=281271,http://www.sisafocus.co.kr/news/articleView.html?idxno=281271,"Tue, 02 Aug 2022 11:14:00 +0900"
743,"포르투갈서 경기 중 인종차별당한 <b>황희찬</b>, 심경 고백",뉴스토마토 = 박창욱 기자 | 사진=<b>황희찬</b> 인스타그램 잉글랜드 프리미어리그 소속 <b>황희찬</b>(울버햄튼)이 친선 경기 중 상대팀 팬들에게 인종차별을 당한 가운데 이에 대한 심경을 남겼다. <b>황희찬</b>은 2일(한국시각) SNS에... ,http://www.newstomato.com/ReadNews.aspx?no=1138565&inflow=N,http://www.newstomato.com/ReadNews.aspx?no=1138565&inflow=N,"Tue, 02 Aug 2022 11:02:00 +0900"
744,친선전서 인종차별 당한 <b>황희찬</b> &quot;누구도 겪어선 안될 일&quot;,"프리시즌 친선경기 도중 인종차별을 당한 잉글랜드 프리미어리그 울버햄프턴 원더러스의 <b>황희찬</b>이 &quot;그 누구도 이런 일을 겪어서는 안된다&quot;고 규탄했다. <b>황희찬</b>은 2일(한국시간) 자신의 SNS에 &quot;구단과 스태프, 동료... ",https://www.mhnse.com/news/articleView.html?idxno=129767,https://sports.news.naver.com/news.nhn?oid=445&aid=0000062723,"Tue, 02 Aug 2022 11:01:00 +0900"
745,"‘인종차별 피해’ <b>황희찬</b>, 입 열었다 “이 세상 누구도 겪어서는 안 돼”","인종차별 발언을 들은 <b>황희찬</b>(울버햄프턴 원더러스)이 입을 열었다. <b>황희찬</b>은 2일(한국 시간) 인스타그램을 통해 한국어와 영어로 “구단, 스태프, 동료, 팬분들 많은 응원 메시지 보내주셔서 감사합니다. 우리는 그저... ",http://www.sportalkorea.com/news/view.php?gisa_uniq=2022080208211521&section_code=20&cp=se&sp=A,https://sports.news.naver.com/news.nhn?oid=139&aid=0002170752,"Tue, 02 Aug 2022 10:43:00 +0900"
746,인종차별 당한 <b>황희찬</b> &quot;누구도 이런 일 겪어선 안 돼&quot;,"프리시즌 경기에서 인종차별을 당했던 <b>황희찬</b>(울버햄튼)이 &quot;누구도 이런 일을 겪어서는 안 된다&quot;고 성토했다. <b>황희찬</b>은 2일(한국시간) 자신의 SNS에 영어와 한국어로 &quot;구단, 스태프 동료, 팬 등이 많은 응원 메시지... ",http://news.tvchosun.com/site/data/html_dir/2022/08/02/2022080290070.html,https://n.news.naver.com/mnews/article/448/0000368032?sid=103,"Tue, 02 Aug 2022 10:36:00 +0900"
747,"<b>황희찬</b>, 친선전 인종차별 &quot;성숙한 태도로 스포츠 즐겨야&quot;","프리시즌 친선경기에서 인종차별을 당한 울버햄튼 원더러스의 <b>황희찬</b>이 SNS를 통해 이같은 일이 일어나서는 안된다고 적었다. <b>황희찬</b>은 2일(한국시간) 인스타그램에 &quot;구단, 스태프, 동료, 팬분들까지 많은 응원 메시지를... ",http://www.slist.kr/news/articleView.html?idxno=373536,http://www.slist.kr/news/articleView.html?idxno=373536,"Tue, 02 Aug 2022 10:32:00 +0900"
748,친선전서 인종차별 당한 <b>황희찬</b>...&quot;누구도 이런 일 겪어선 안 돼&quot;,"프리시즌 친선경기에서 인종차별을 당한 잉글랜드 프로축구 울버햄프턴 원더러스의 <b>황희찬</b>(26)이 &quot;이런 일을 겪어서는 안 된다&quot;고 규탄했다. <b>황희찬</b>은 2일(한국시간) 인스타그램에 &quot;구단, 스태프, 동료, 팬분들까지 많은... ",http://www.maniareport.com/view.php?ud=2022080210273158045e8e941087_19,https://sports.news.naver.com/news.nhn?oid=425&aid=0000131247,"Tue, 02 Aug 2022 10:31:00 +0900"
749,&apos;인종차별&apos; 당한 <b>황희찬</b> &quot;NO TO RACISM&quot;...심지어 &apos;레이저 테러&apos;도 있었다,"프리시즌 경기 도중 인종차별을 당한 <b>황희찬</b>이 입장을 밝혔다. <b>황희찬</b>은 2일(한국시간) 자신의 SNS에 프리시즌 친선 경기 도중 자신이 당한 인종 차별에 대해 입장을 밝혔다. 그는 &quot;구단, 스태프, 동료, 팬분들 많은 응원... ",https://www.xportsnews.com/article/1612587,https://sports.news.naver.com/news.nhn?oid=311&aid=0001483601,"Tue, 02 Aug 2022 10:28:00 +0900"
750,"<b>황희찬</b>, 경기 중 인종차별 당해…울버햄프턴 “조사 요청할 것”",잉글랜드 프리미어리그(EPL)에서 뛰는 <b>황희찬</b>(26·울버햄프턴)이 프리시즌 경기 중 인종차별을 당했다고 밝혀 소속 구단이 조사를 요청하고 나섰다. 영국 &lt;인디펜던트&gt; 등 현지 매체의 보도를 보면 <b>황희찬</b>은 전날 포르투갈... ,https://www.hani.co.kr/arti/sports/soccer/1053174.html,https://sports.news.naver.com/news.nhn?oid=028&aid=0002600830,"Tue, 02 Aug 2022 10:25:00 +0900"
751,"손흥민에 <b>황희찬</b>까지…“인종차별, 누구도 겪어선 안돼”","프리시즌 친선경기에서 인종차별을 당한 <b>황희찬</b>(26·울버햄턴)이 “누구도 이런 일을 겪어서는 안 된다”고 성토했다. <b>황희찬</b>은 2일 인스타그램에 “구단 스태프, 동료, 팬분들까지 많은 응원 메시지를 보내주셔서... ",https://news.kmib.co.kr/article/view.asp?arcid=0017334081&code=61131111&cp=nv,https://n.news.naver.com/mnews/article/005/0001543828?sid=104,"Tue, 02 Aug 2022 10:17:00 +0900"
752,포르투갈서 인종차별 당한 <b>황희찬</b> &quot;누구도 이런 일 겪어선 안 돼&quot;,"친선경기에서 인종차별을 당한 <b>황희찬</b>(26·울버햄튼)이 같은 일이 절대로 다시 일어나선 안 된다고 강조했다. <b>황희찬</b>은 2일(한국시간) 인스타그램에 &quot;구단, 스태프, 동료, 팬분들까지 많은 응원 메시지를 보내주셔서... ",http://www.inews24.com/view/1506361,https://sports.news.naver.com/news.nhn?oid=031&aid=0000689151,"Tue, 02 Aug 2022 10:13:00 +0900"
753,인종차별 당한 <b>황희찬</b> &quot;누구도 이런 일 겪어선 안 돼&quot;,울버햄프턴 원더러스의 <b>황희찬</b>(춘천 출신)이 최근 자신이 겪은 인종차별과 관련해 이를 비판하는 목소리를 냈다. <b>황희찬</b>은 2일(한국시간) 자신의 인스타그램에 &quot;우리는 그저 (모두가) 같은 인간&quot;이라며 &quot;성숙한 태도로 이... ,http://www.kado.net/news/articleView.html?idxno=1137979,https://sports.news.naver.com/news.nhn?oid=654&aid=0000016427,"Tue, 02 Aug 2022 10:08:00 +0900"
754,인종차별 당한 <b>황희찬</b> &quot;누구도 이런 일 겪어선 안 돼&quot;,"프리시즌 친선경기에서 인종차별을 당한 잉글랜드 프리미어리그(EPL) <b>황희찬</b>(26·울버햄튼)이 &quot;이런 일을 겪어서는 안 된다&quot;는 메시지를 전했다. <b>황희찬</b>은 2일 자신의 소셜미디어(SNS)에 &quot;구단, 스태프, 동료, 팬분들까지... ",https://isplus.com/2022/08/02/sports/football/20220802100636590.html,https://sports.news.naver.com/news.nhn?oid=241&aid=0003223311,"Tue, 02 Aug 2022 10:06:00 +0900"
755,"<b>황희찬</b>, 인종차별 규탄 “누구도 이런 일 겪어서는 안 돼”","<b>황희찬</b>(울버햄튼)이 인종차별을 규탄했다. <b>황희찬</b>은 2일(한국시각) 자신의 SNS에 “구단, 스태프, 동료, 팬분들까지 많은 응원 메시지를 보내주셔서 감사하다”며 “우리는 그저 같은 인간”이라고 적었다. 이어... ",https://www.dailian.co.kr/news/view/1138602/?sc=Naver,https://sports.news.naver.com/news.nhn?oid=119&aid=0002626557,"Tue, 02 Aug 2022 10:02:00 +0900"
756,"&quot;동료, 후배들이 이런 일 겪어선 안 돼&quot; <b>황희찬</b>, 인종차별에 직접 대응","프리시즌 친선경기에서 인종차별을 당했던 <b>황희찬</b>(울버햄턴원더러스)이 개인 소셜미디어(SNS)를 통해 직접 규탄의 목소리를 냈다. <b>황희찬</b>은 2일(한국시간) SNS를 통해 &quot;구단, 스태프, 동료, 팬분들 많은 응원 메시지... ",http://www.footballist.co.kr/news/articleView.html?idxno=153495,https://sports.news.naver.com/news.nhn?oid=436&aid=0000061518,"Tue, 02 Aug 2022 09:56:00 +0900"
757,‘인종차별 피해’ <b>황희찬</b> “우린 같은 인간‥누구도 겪어선 안 된다”,"잉글랜드 프로축구 울버햄튼 <b>황희찬</b>(26)이 프리시즌 친선경기에서 인종차별을 당한 것과 관련, “이 세상 그 누구도 이런 일을 겪어서는 안 된다”고 규탄했다. <b>황희찬</b>은 2일 본인 소셜미디어(SNS)에 “구단, 스태프... ",http://sports.khan.co.kr/news/sk_index.html?art_id=202208020949003&sec_id=520401&pt=nv,https://sports.news.naver.com/news.nhn?oid=144&aid=0000828703,"Tue, 02 Aug 2022 09:50:00 +0900"
758,포르투갈서 인종차별 당한 <b>황희찬</b> &quot;누구도 이런 일 겪어선 안 된다&quot;,"프리시즌 친선경기 도중 인종차별을 당한 <b>황희찬</b>(26‧울버햄튼)이 더 이상 피해자가 나와서는 안 된다고 주장했다. <b>황희찬</b>은 2일(한국시간) 자신의 소셜네트워크서비스(SNS)에 &quot;구단, 스태프, 동료, 팬 등이 많은 응원... ",http://www.starnewsk.com/news/articleView.html?idxno=32338,http://www.starnewsk.com/news/articleView.html?idxno=32338,"Tue, 02 Aug 2022 09:50:00 +0900"
759,&apos;손흥민도 <b>황희찬</b>도&apos;... 유럽축구 또 인종차별 논란,넣은 <b>황희찬</b>과 기뻐하고 있다. (사진=뉴시스)  유럽축구 내 아시아 선수를 향한 &apos;인종차별&apos; 논란이 여전히... 독일 분데스리가 시절 인총차별 경험을 고백한 캡틴 손흥민(토느넘)에 이어 이번에는 <b>황희찬</b>(울버햄튼)도... ,http://www.hg-times.com/news/articleView.html?idxno=243406,http://www.hg-times.com/news/articleView.html?idxno=243406,"Tue, 02 Aug 2022 09:48:00 +0900"
760,‘인종차별 피해’ <b>황희찬</b> “누구도 이런 일 겪어선 안 돼”,잉글랜드 프리미어리그(EPL) 울버햄튼에서 활약 중인 <b>황희찬</b>이 프리시즌 친선경기에서 인종차별 피해를 입은 것을 두고 “누구도 이런 일을 겪어서는 안 된다”고 규탄했다. <b>황희찬</b>은 2일(한국시간) 자신의 인스타그램에... ,https://www.donga.com/news/article/all/20220802/114767882/2,https://sports.news.naver.com/news.nhn?oid=020&aid=0003443427,"Tue, 02 Aug 2022 09:32:00 +0900"
761,인종차별 당한 <b>황희찬</b> “누구도 이런 일 겪어서는 안 돼”,"잉글랜드 프로축구 울버햄프턴 원더러스의 <b>황희찬</b>(26)이 인종차별을 반대하는 메시지를 전했다. <b>황희찬</b>은 2일(한국 시간) 소셜네트워크서비스(SNS)를 통해 “구단, 스태프, 동료, 팬분들까지 많은 응원 메시지를 보내주셔서... ",https://www.sedaily.com/NewsView/269N3Y88XR,https://sports.news.naver.com/news.nhn?oid=011&aid=0004082849,"Tue, 02 Aug 2022 09:22:00 +0900"
762,친선전서 인종차별 당한 <b>황희찬</b> &quot;누구도 이런 일 겪어선 안 돼&quot;,"프리시즌 친선경기에서 인종차별을 당한 잉글랜드 프로축구 울버햄튼의 <b>황희찬</b>이 &quot;이런 일을 겪어서는 안 된다&quot;고 규탄했습니다. <b>황희찬</b>은 인스타그램에 &quot;구단, 스태프, 동료, 팬분들까지 많은 응원 메시지를 보내주셔서... ",https://news.sbs.co.kr/news/endPage.do?news_id=N1006845130&plink=ORI&cooper=NAVER,https://sports.news.naver.com/news.nhn?oid=055&aid=0000990067,"Tue, 02 Aug 2022 09:21:00 +0900"
763,인종차별 당한 <b>황희찬</b> “이 세상 누구도 이런 일 겪어선 안 돼”,"<b>황희찬</b>(울버햄프턴 원더러스)이 인종차별 행위를 규탄했다. 2일 오전(한국시간) <b>황희찬</b>은 SNS에 &quot;구단, 스태프, 동료, 팬분들까지 많은 응원 메시지를 보내주셔서 감사하다&quot;며 &quot;우리는 그저 같은 인간&quot;이라고 글을 남겼다.... ",http://www.munhwa.com/news/view.html?no=2022080201039939044003,https://sports.news.naver.com/news.nhn?oid=021&aid=0002524641,"Tue, 02 Aug 2022 09:16:00 +0900"
764,인종차별 피해 <b>황희찬</b> “누구도 이런 일 겪어선 안 돼”,"잉글랜드 프로축구 울버햄프턴 원더러스의 <b>황희찬</b>(26)이 프리시즌 친선경기에서 인종차별을 당한 것과 관련, “이 세상 그 누구도 이런 일을 겪어서는 안 된다”고 호소했다. <b>황희찬</b>은 2일(한국시간) 인스타그램 계정에... ",https://sports.donga.com/article/all/20220802/114767653/2,https://sports.news.naver.com/news.nhn?oid=382&aid=0000996183,"Tue, 02 Aug 2022 09:16:00 +0900"
765,친선전서 인종차별 당한 <b>황희찬</b> &quot;누구도 이런 일 겪어선 안돼&quot;,"프리시즌 친선전 도중 인종차별을 당한 <b>황희찬</b>(울버햄튼)이 &quot;누구도 겪어서는 안되는 일&quot;이라고 목소리를 높였다. <b>황희찬</b>은 2일(한국시각) 자신의 SNS를 통해 &quot;구단, 스태프, 동료, 팬 분들 많은 응원 메시지 보내주셔서... ",http://www.stoo.com/article.php?aid=81728152391,http://www.stoo.com/article.php?aid=81728152391,"Tue, 02 Aug 2022 09:16:00 +0900"
766,인종차별 당한 울버햄프턴 <b>황희찬</b> &quot;누구도 이런 일 겪어선 안 돼&quot;,"프리시즌 친선경기에서 인종차별을 당한 잉글랜드 프로축구 울버햄프턴의 <b>황희찬</b>이 &quot;누구도 이런 일을 겪어선 안 된다&quot;고 목소리를 냈습니다. <b>황희찬</b>은 자신의 인스타그램에 &quot;우리는 그저 같은 인간이고, 오늘을... ",https://imnews.imbc.com/news/2022/sports/article/6394346_35701.html,https://sports.news.naver.com/news.nhn?oid=214&aid=0001212915,"Tue, 02 Aug 2022 09:15:00 +0900"
767,인종차별 당한 <b>황희찬</b> &quot;누구도 이런일 겪어선 안돼&quot;,"프리시즌 친선경기에서 인종차별을 받은 <b>황희찬</b>(26‧울버햄튼)이 &quot;누구도 이런 일을 겪어서는 안된다&quot;라고 성토했다. <b>황희찬</b>은 2일(한국시간) 자신의 SNS에 &quot;구단, 스태프 동료, 팬 등이 많은 응원 메시지 보내주셔서... ",https://www.hankyung.com/sports/article/202208020122i,https://sports.news.naver.com/news.nhn?oid=015&aid=0004731738,"Tue, 02 Aug 2022 09:12:00 +0900"
768,&apos;인종차별 피해&apos; <b>황희찬</b>… &quot;모든 곳에서 오늘이 마지막이길&quot;,"<b>황희찬</b>(26·울버햄튼 원더러스)이 인종차별 반대 입장을 밝혔다. <b>황희찬</b>은 2일(이하 한국시각) 자신의 인스타그램에 &quot;구단, 스태프, 동료, 팬 등이 많은 응원 메시지 보내주셔서 감사하다&quot;고 전했다. 이어 &quot;성숙한 태도로... ",http://moneys.mt.co.kr/news/mwView.php?no=2022080208275695468,https://sports.news.naver.com/news.nhn?oid=417&aid=0000838617,"Tue, 02 Aug 2022 09:12:00 +0900"
769,"<b>황희찬</b>, 포르투갈 경기서 인종차별 당해…&quot;누구도 이런 일 겪어선 안 돼&quot;","프리시즌 친선경기에서 인종차별을 당한 잉글랜드 프로축구 울버햄프턴 원더러스의 <b>황희찬</b>(26)이 &quot;이런 일을 겪어서는 안 된다&quot;고 규탄했다. <b>황희찬</b>은 2일(한국시간) 인스타그램에 &quot;구단, 스태프, 동료, 팬분들까지 많은... ",http://news.heraldcorp.com/view.php?ud=20220802000089,https://n.news.naver.com/mnews/article/016/0002023245?sid=103,"Tue, 02 Aug 2022 09:08:00 +0900"
770,인종차별 당한 <b>황희찬</b> &quot;누구도 겪어서는 안 될 일&quot;,프리시즌 친선 경기에서 인종차별 행위를 당했던 ‘황소’ <b>황희찬</b>(26·울버햄튼)이 &quot;이런 일을 겪어서는 안 된다&quot;고 규탄했다. 잉글랜드 프리미어리그(EPL) 울버햄튼에서 활약하는 <b>황희찬</b>은 2일(한국시간) 자신의 SNS... ,https://isplus.com/2022/08/02/sports/football/20220802085653573.html,https://sports.news.naver.com/news.nhn?oid=241&aid=0003223295,"Tue, 02 Aug 2022 08:56:00 +0900"
771,친선전서 인종차별 당한 <b>황희찬</b> &quot;누구도 이런 일 겪어선 안 돼&quot;,"프리시즌 친선경기에서 인종차별을 당한 잉글랜드 프로축구 울버햄프턴 원더러스의 <b>황희찬</b>(26)이 &quot;이런 일을 겪어서는 안 된다&quot;고 규탄했습니다. <b>황희찬</b>은 오늘(2일)(한국시간) 인스타그램에 &quot;구단, 스태프, 동료... ",https://news.sbs.co.kr/news/endPage.do?news_id=N1006845064&plink=ORI&cooper=NAVER,https://sports.news.naver.com/news.nhn?oid=055&aid=0000990061,"Tue, 02 Aug 2022 08:47:00 +0900"
772,친선전서 인종차별 당한 <b>황희찬</b> &quot;누구도 이런 일 겪어선 안 돼&quot;,"프리시즌 친선경기에서 인종차별을 당한 잉글랜드 프로축구 울버햄프턴 원더러스의 <b>황희찬</b>(26)이 &quot;이런 일을 겪어서는 안 된다&quot;고 규탄했다. <b>황희찬</b>은 2일(한국시간) 인스타그램에 &quot;구단, 스태프, 동료, 팬분들까지 많은... ",https://www.yna.co.kr/view/AKR20220802029700007?input=1195m,https://sports.news.naver.com/news.nhn?oid=001&aid=0013348639,"Tue, 02 Aug 2022 08:40:00 +0900"
773,"<b>황희찬</b>, 인종차별 반대 메시지 “누구도 겪어선 안 될 일”","국가대표 골잡이 <b>황희찬</b>(26·울버햄프턴)이 최근 자신이 경험한 인종차별과 관련해 목소리를 높였다. <b>황희찬</b>은 2일 자신의 사회관계망서비스(SNS)를 통해 “오늘을 마지막으로 더 이상 내 동료들과 후배들, 이 세상 그... ",http://sports.khan.co.kr/news/sk_index.html?art_id=202208020831013&sec_id=520401&pt=nv,https://sports.news.naver.com/news.nhn?oid=144&aid=0000828677,"Tue, 02 Aug 2022 08:32:00 +0900"
774,"<b>황희찬</b> &quot;인종차별, 누구도 겪어서는 안 돼&quot;","프리시즌 경기 중 인종차별을 당한 <b>황희찬</b>(26‧울버햄튼)이 더 이상 피해자가 나와서는 안 된다고 주장했다. <b>황희찬</b>은 2일(한국시간) 자신의 사회관계망서비스(SNS)에 “구단, 스태프, 동료, 팬 등이 많은 응원 메시지... ",https://hankookilbo.com/News/Read/A2022080208260003437?did=NA,https://sports.news.naver.com/news.nhn?oid=469&aid=0000689403,"Tue, 02 Aug 2022 08:31:00 +0900"
775,손흥민에 <b>황희찬</b>까지…끊이지 않는 유럽축구 인종차별,"기사내용 요약 <b>황희찬</b>, 프리시즌 마지막 경기서 인종차별 욕설 들어 손흥민, 독일 시절 &apos;인종차별... 후배인 <b>황희찬</b>(울버햄튼)과 이강인(마요르카)이 인종차별 논란에 휘말렸다. <b>황희찬</b>은 지난 1일(한국시간) 포르투갈... ",http://www.newsis.com/view/?id=NISX20220801_0001963981&cID=10523&pID=10500,https://sports.news.naver.com/news.nhn?oid=003&aid=0011339503,"Tue, 02 Aug 2022 08:30:00 +0900"
776,인종차별 당한 <b>황희찬</b> &quot;누구도 겪어선 안 될 일&quot;,프리시즌 친선경기 도중 인종차별을 당한 잉글랜드 프로축구 프리미어리그(EPL) 울버햄튼 원더러스의 공격수 <b>황희찬</b>(26)이 다시는 비슷한 일이 벌어지면 안 된다며 목소리를 높였다. <b>황희찬</b>은 2일(한국시간) 자신의... ,http://www.newsis.com/view/?id=NISX20220802_0001964255&cID=10523&pID=10500,https://sports.news.naver.com/news.nhn?oid=003&aid=0011339494,"Tue, 02 Aug 2022 08:19:00 +0900"
777,&apos;인종차별 겪은&apos; <b>황희찬</b> &quot;누구도 겪어서는 안 되는 일&quot;,"프리시즌 도중 인종차별 발언을 들은 <b>황희찬</b>(26, 울버햄프턴 원더러스)이 입을 열었다. <b>황희찬</b>은 2일(한국시간) 자신의 SNS를 통해 한국어와 영어로 &quot;구단, 스태프, 동료, 팬분들 많은 응원 메시지 보내주셔서 감사합니다.... ",https://www.nocutnews.co.kr/news/5796175,https://sports.news.naver.com/news.nhn?oid=079&aid=0003670743,"Tue, 02 Aug 2022 08:03:00 +0900"
778,"인종차별에 목소리 낸 <b>황희찬</b>, &quot;누구든 이런 일 겪어서는 안 돼&quot;",<b>황희찬</b>(26)이 인종차별 반대의 목소리를 냈다. 울버햄튼은 1일 포르투갈 파로에서 열린 SC 파렌세와의 프리시즌 경기에서 <b>황희찬</b>의 페널티킥 득점으로 1-1 무승부를 거뒀다. 이날 그러나 울버햄튼의 한 선수가 인종차별을... ,http://www.stnsports.co.kr/news/articleView.html?idxno=152983,https://sports.news.naver.com/news.nhn?oid=450&aid=0000086373,"Tue, 02 Aug 2022 07:55:00 +0900"
779,"유럽 5대리그 누비는 한국 축구, 새로운 시대가 활짝 열린다",EPL 데뷔 첫 해 성공적인 시즌을 보낸 울버햄프턴 <b>황희찬</b>(26)도 지난 시즌 이상의 활약을 노리고 있다. 울버햄프턴 입단 후 첫 6경기에서 4골을 터뜨린 뒤 이후 24경기에서 1골에 그친 것은 아쉬운 부분이었다. 이번 시즌은... ,http://starin.edaily.co.kr/news/newspath.asp?newsid=01121766632423384,https://sports.news.naver.com/news.nhn?oid=018&aid=0005281803,"Tue, 02 Aug 2022 07:54:00 +0900"
780,포르투갈서 인종차별 받은 <b>황희찬</b> &quot;이 세상 누구도 겪어서 안 돼&quot;,"포르투갈서 보내는 프리시즌 일정 중 인종차별을 받은 <b>황희찬</b>(26‧울버햄튼)이 더 이상 피해자가 나와서는 안 된다고 주장했다. <b>황희찬</b>은 2일(이하 한국시간) 자신의 소셜네트워크서비스(SNS)에 &quot;구단, 스태프, 동료, 팬... ",https://www.news1.kr/articles/4760372,https://sports.news.naver.com/news.nhn?oid=421&aid=0006253912,"Tue, 02 Aug 2022 07:48:00 +0900"
781,울버햄튼 공격 보강 준비...&apos;<b>황희찬</b> 파트너&apos; 부상→대체자 급구,"<b>황희찬</b>이 활약 중인 울버햄튼이 라울 히메네스 공백을 메우기 위한 영입 작업에 착수할 전망이다. 지난... 울버햄튼의 팀 내 득점 1, 2위는 히메네스(6골), <b>황희찬</b>(5골)이었다. <b>황희찬</b>은 지난 시즌을 앞두고 RB라이프치히를... ",http://www.interfootball.co.kr/news/articleView.html?idxno=577937,https://sports.news.naver.com/news.nhn?oid=413&aid=0000143878,"Tue, 02 Aug 2022 05:32:00 +0900"
